{
  "updated_utc": "2026-10-13T07:03:28Z",
  "vms": [
    {
      "name": "atlas",
      "reachable": true,
      "load1": 0.82,
      "mem": "1811/11925"
    },
    {
      "name": "butler",
      "reachable": true,
      "load1": 0.02,
      "mem": "343/952"
    },
    {
      "name": "gatekeeper",
      "reachable": true,
      "load1": 0.06,
      "mem": "323/952"
    },
    {
      "name": "watcher",
      "reachable": true,
      "load1": 0.2,
      "mem": "737/964"
    }
  ],
  "cron_count": 33,
  "outputs": {
    "total": 178,
    "public": 0
  },
  "world2_soak_tick": 4187700,
  "shadow_last_run": "2026-10-13T06:35:51Z"
}